{
  "version": 1,
  "lastReviewedDate": "2026-05-17",
  "actors": [
    {
      "name": "TenantA",
      "organizationId": 1001,
      "userId": 2001,
      "permissions": [
        "ProjectsRead",
        "ProjectsWrite",
        "BuildingsRead",
        "BuildingsWrite",
        "WorkflowsRead",
        "WorkflowsExecute",
        "ReportsRead",
        "ReportsWrite"
      ]
    },
    {
      "name": "TenantB",
      "organizationId": 1002,
      "userId": 2002,
      "permissions": [
        "ProjectsRead",
        "ProjectsWrite",
        "BuildingsRead",
        "BuildingsWrite",
        "WorkflowsRead",
        "WorkflowsExecute",
        "ReportsRead",
        "ReportsWrite"
      ]
    },
    {
      "name": "Anonymous",
      "organizationId": null,
      "userId": null,
      "permissions": []
    },
    {
      "name": "LimitedPrincipal",
      "organizationId": 1001,
      "userId": 2001,
      "permissions": [
        "VariesByTestWithoutRequiredPermission"
      ]
    }
  ],
  "resourceFamilies": [
    {
      "name": "ProjectA",
      "tenant": "TenantA",
      "scope": "Project"
    },
    {
      "name": "BuildingA",
      "tenant": "TenantA",
      "scope": "ProjectA/Building"
    },
    {
      "name": "WorkflowA",
      "tenant": "TenantA",
      "scope": "ProjectA/BuildingA/Workflow"
    },
    {
      "name": "ScenarioA",
      "tenant": "TenantA",
      "scope": "WorkflowA/Scenario"
    },
    {
      "name": "JobA",
      "tenant": "TenantA",
      "scope": "WorkflowA/Job"
    },
    {
      "name": "ReportA",
      "tenant": "TenantA",
      "scope": "WorkflowA or BuildingA report output"
    },
    {
      "name": "ArtifactA",
      "tenant": "TenantA",
      "scope": "WorkflowA or ReportA artifact output"
    }
  ],
  "endpointGroups": [
    {
      "group": "ProjectsRead",
      "permission": "ProjectsRead",
      "rolloutStage": "P5-10",
      "controllerIntegration": "P5-16C",
      "tenantAwareQueryService": true,
      "sameTenantExpected": "Success",
      "missingPermissionExpected": "Forbidden",
      "crossTenantExpected": "ForbiddenOrNotFoundByOption",
      "anonymousExpected": "Unauthorized",
      "coveredByTests": [
        "TenantIsolationAuthorizationGateMatrixTests",
        "TenantIsolationProtectedEndpointSmokeTests",
        "ProtectedReadEndpointsPilotTests",
        "ProtectedReadControllersTenantScopedQueryIntegrationTests"
      ],
      "knownLimitations": []
    },
    {
      "group": "ProjectsWrite",
      "permission": "ProjectsWrite",
      "rolloutStage": "P5-11",
      "sameTenantExpected": "Success",
      "missingPermissionExpected": "Forbidden",
      "crossTenantExpected": "ForbiddenOrNotFoundByOption",
      "anonymousExpected": "Unauthorized",
      "coveredByTests": [
        "TenantIsolationAuthorizationGateMatrixTests",
        "ProtectedWriteEndpointsPilotTests"
      ],
      "knownLimitations": []
    },
    {
      "group": "BuildingsRead",
      "permission": "BuildingsRead",
      "rolloutStage": "P5-10",
      "controllerIntegration": "P5-16C",
      "tenantAwareQueryService": true,
      "sameTenantExpected": "Success",
      "missingPermissionExpected": "Forbidden",
      "crossTenantExpected": "ForbiddenOrNotFoundByOption",
      "anonymousExpected": "Unauthorized",
      "coveredByTests": [
        "TenantIsolationAuthorizationGateMatrixTests",
        "TenantIsolationProtectedEndpointSmokeTests",
        "ProtectedReadEndpointsPilotTests",
        "ProtectedReadControllersTenantScopedQueryIntegrationTests"
      ],
      "knownLimitations": []
    },
    {
      "group": "BuildingsWrite",
      "permission": "BuildingsWrite",
      "rolloutStage": "P5-11",
      "sameTenantExpected": "Success",
      "missingPermissionExpected": "Forbidden",
      "crossTenantExpected": "ForbiddenOrNotFoundByOption",
      "anonymousExpected": "Unauthorized",
      "coveredByTests": [
        "TenantIsolationAuthorizationGateMatrixTests",
        "ProtectedWriteEndpointsPilotTests"
      ],
      "knownLimitations": []
    },
    {
      "group": "WorkflowsRead",
      "permission": "WorkflowsRead",
      "rolloutStage": "P5-14+P5-16D",
      "controllerIntegration": "P5-16D",
      "tenantAwareQueryService": true,
      "metadataCoverage": "Partial",
      "sameTenantExpected": "Success",
      "missingPermissionExpected": "Forbidden",
      "crossTenantExpected": "ForbiddenOrNotFoundByOption",
      "anonymousExpected": "Unauthorized",
      "coveredByTests": [
        "TenantIsolationAuthorizationGateMatrixTests",
        "TenantIsolationProtectedEndpointSmokeTests",
        "ProtectedWorkflowReadEndpointsPilotTests",
        "ProtectedWorkflowReadControllersTenantScopedQueryIntegrationTests",
        "DefaultWorkflowAccessScopeResolverMetadataCoverageTests",
        "WorkflowTenantScopedReadServiceMetadataCoverageTests"
      ],
      "knownLimitations": [
        "Workflow tenant-aware read integration remains rollout-option gated and default-disabled.",
        "Metadata-incomplete workflow paths remain staged and strict/compatibility-option controlled."
      ]
    },
    {
      "group": "WorkflowsExecute",
      "permission": "WorkflowsExecute",
      "rolloutStage": "P5-12",
      "sameTenantExpected": "Success",
      "missingPermissionExpected": "Forbidden",
      "crossTenantExpected": "ForbiddenOrNotFoundByOption",
      "anonymousExpected": "Unauthorized",
      "coveredByTests": [
        "TenantIsolationAuthorizationGateMatrixTests",
        "TenantIsolationProtectedEndpointSmokeTests",
        "ProtectedExecutionEndpointsPilotTests"
      ],
      "knownLimitations": [
        "Workflow-id ownership resolution still uses staged fallback when durable workflow metadata is incomplete.",
        "P5-16A provides persisted Project ownership source where workflow metadata includes ProjectId or BuildingId."
      ]
    },
    {
      "group": "CalculationRun",
      "permission": "WorkflowsExecute",
      "rolloutStage": "P5-12",
      "sameTenantExpected": "Success",
      "missingPermissionExpected": "Forbidden",
      "crossTenantExpected": "ForbiddenOrNotFoundByOption",
      "anonymousExpected": "Unauthorized",
      "coveredByTests": [
        "TenantIsolationAuthorizationGateMatrixTests",
        "TenantIsolationProtectedEndpointSmokeTests",
        "ProtectedExecutionEndpointsPilotTests"
      ],
      "knownLimitations": [
        "CalculationRun uses WorkflowsExecute until a dedicated calculation permission is introduced.",
        "Building/project calculation scope can inherit persisted Project ownership when resolver metadata is available."
      ]
    },
    {
      "group": "ReportsRead",
      "permission": "ReportsRead",
      "rolloutStage": "P5-13",
      "sameTenantExpected": "Success",
      "missingPermissionExpected": "Forbidden",
      "crossTenantExpected": "ForbiddenOrNotFoundByOption",
      "anonymousExpected": "Unauthorized",
      "coveredByTests": [
        "TenantIsolationAuthorizationGateMatrixTests",
        "TenantIsolationProtectedEndpointSmokeTests",
        "ProtectedReportArtifactEndpointsPilotTests"
      ],
      "knownLimitations": []
    },
    {
      "group": "ReportsWrite",
      "permission": "ReportsWrite",
      "rolloutStage": "P5-13",
      "sameTenantExpected": "Success",
      "missingPermissionExpected": "Forbidden",
      "crossTenantExpected": "ForbiddenOrNotFoundByOption",
      "anonymousExpected": "Unauthorized",
      "coveredByTests": [
        "TenantIsolationAuthorizationGateMatrixTests",
        "ProtectedReportArtifactEndpointsPilotTests"
      ],
      "knownLimitations": []
    },
    {
      "group": "ArtifactRead",
      "permission": "ReportsRead",
      "rolloutStage": "P5-13",
      "sameTenantExpected": "Success",
      "missingPermissionExpected": "Forbidden",
      "crossTenantExpected": "ForbiddenOrNotFoundByOption",
      "anonymousExpected": "Unauthorized",
      "coveredByTests": [
        "TenantIsolationAuthorizationGateMatrixTests",
        "ProtectedReportArtifactEndpointsPilotTests"
      ],
      "knownLimitations": [
        "Dedicated ArtifactRead permission is not introduced; ReportsRead is used for report artifacts.",
        "Dedicated public artifact write/delete endpoints are not exposed yet."
      ]
    },
    {
      "group": "WorkflowScenarioRead",
      "permission": "WorkflowsRead",
      "rolloutStage": "P5-14+P5-16D",
      "controllerIntegration": "P5-16D",
      "tenantAwareQueryService": true,
      "metadataCoverage": "Partial",
      "sameTenantExpected": "Success",
      "missingPermissionExpected": "Forbidden",
      "crossTenantExpected": "ForbiddenOrNotFoundByOption",
      "anonymousExpected": "Unauthorized",
      "coveredByTests": [
        "TenantIsolationAuthorizationGateMatrixTests",
        "ProtectedWorkflowReadEndpointsPilotTests",
        "ProtectedWorkflowReadControllersTenantScopedQueryIntegrationTests",
        "WorkflowTenantScopedReadServiceMetadataCoverageTests"
      ],
      "knownLimitations": [
        "Scenario tenant scope depends on persisted scenario/workflow/project metadata coverage."
      ]
    },
    {
      "group": "WorkflowJobRead",
      "permission": "WorkflowsRead",
      "rolloutStage": "P5-14+P5-16D",
      "controllerIntegration": "P5-16D",
      "tenantAwareQueryService": true,
      "metadataCoverage": "Partial",
      "sameTenantExpected": "Success",
      "missingPermissionExpected": "Forbidden",
      "crossTenantExpected": "ForbiddenOrNotFoundByOption",
      "anonymousExpected": "Unauthorized",
      "coveredByTests": [
        "TenantIsolationAuthorizationGateMatrixTests",
        "ProtectedWorkflowReadEndpointsPilotTests",
        "ProtectedWorkflowReadControllersTenantScopedQueryIntegrationTests",
        "WorkflowTenantScopedReadServiceMetadataCoverageTests"
      ],
      "knownLimitations": [
        "Job tenant scope depends on workflow/job/project metadata availability."